{
  "version": 1,
  "request_id": "REQ-demo-fixture-manual-review",
  "package_manager": "npm",
  "scanner_mode": {
    "snyk": "fixture",
    "socket": "skip"
  },
  "sandbox_mode": "disabled",
  "fixtures": {
    "poc_app": "fixtures/poc-app",
    "malicious_package": "fixtures/malicious-poc-pkg",
    "snyk_report": "fixtures/reports/snyk-pass.json",
    "socket_report": null,
    "openshell_log": null,
    "canary_secret": "fixtures/canary/synthetic-canary.txt"
  },
  "outputs": {
    "decision_json": "reports/demo-fixture-manual-review-decision.json",
    "markdown_summary": "reports/demo-fixture-manual-review-summary.md"
  },
  "safety": {
    "synthetic_egress_target": "https://chainshield-egress-test.invalid/collect",
    "sandbox_demo_override": {
      "enabled": false,
      "reason": null
    }
  }
}
